{
  "$schema": "http://json-schema.org/draft-07/schema#",
  "$id": "hotlines.schema.json",
  "type": "object",
  "required": ["lastUpdated", "source", "emergencyNumber", "hotlines"],
  "properties": {
    "lastUpdated": { "type": "string", "pattern": "^\\d{4}-\\d{2}-\\d{2}$" },
    "source": { "type": "string", "minLength": 1 },
    "emergencyNumber": { "type": "string", "minLength": 1 },
    "hotlines": {
      "type": "array",
      "items": {
        "type": "object",
        "required": ["key", "name", "numbers"],
        "properties": {
          "key": { "type": "string", "minLength": 1 },
          "name": { "type": "string", "minLength": 1 },
          "description": { "type": "string" },
          "icon": { "type": "string" },
          "numbers": {
            "type": "array",
            "items": { "type": "string", "minLength": 1 },
            "minItems": 1
          }
        },
        "additionalProperties": false
      }
    }
  },
  "additionalProperties": false
}
